{
  "profile_version": "1.0",
  "contract_binding": {"contract_version": "2.0"},
  "object_type": "repair_plan_verification",
  "verification_id": "verification:w3b-a:fixture:001",
  "plan_id": "plan:w3b-a:fixture:001",
  "plan_digest": "sha256:8e464359205cd5d5b9df2786ff5fe4e75e9b670d262458c52eb3b03a541cae7e",
  "snapshot_digest": "sha256:1111111111111111111111111111111111111111111111111111111111111111",
  "evidence_set_digest": "sha256:6c6906ceafc296e8997170abd5d4f719f10bfabee9e59efee105cbca4f632cec",
  "verification_state": "PLAN_VERIFIED",
  "verified_at": "2026-08-25T10:01:00Z",
  "checks": [
    "SCHEMA_VALID",
    "PLAN_DIGEST_MATCH",
    "SNAPSHOT_BINDING_MATCH",
    "EVIDENCE_BINDING_MATCH",
    "VERSION_BINDING_MATCH",
    "PROPOSED_DIFF_VOCABULARY_VALID",
    "DESTRUCTIVE_PROPOSAL_ABSENT",
    "EXPECTED_INVARIANTS_VALID",
    "NON_AUTHORITY_TAINT_COMPLETE",
    "TERMINAL_STATE_PRESERVED"
  ],
  "shadow_status": "SHADOW_ONLY",
  "execution_eligibility": "EXECUTION_INELIGIBLE",
  "authority_status": "AUTHORITY_NONE",
  "mutation_status": "MUTATION_NONE",
  "governance_status": "UNAUTHENTICATED_SHADOW",
  "authority_effect": "NONE",
  "identity_effect": "NONE",
  "execution_effect": "NONE",
  "activation_effect": "NONE",
  "eligible_for_execution": false,
  "plan_effect": "NONE",
  "mutation_effect": "NONE"
}
